{
  "schemaVersion": 1,
  "task": "C02",
  "owner": "ui-router-maintainers",
  "c01": {
    "mergeCommit": "ccdeafc6f51ce4ba175f8a590e2a615d6af3d1be",
    "head": "7cd43281168dd15e20a1f64e9bda33bf98b5b231",
    "tree": "a5e2d1bca11b54ccf64bc30eb146b03336fa6265"
  },
  "bindings": {
    "ciGatesSha256": "e731bff4f14c7788c8d614da864c62a3d2df3b72e9153a137c229a37b9507f62",
    "packageJsonSha256": "25a6e83d09a91c32992d636387e436c52384374e8f7e15e8612da927ea36621c",
    "packageLockSha256": "20af880a5aada78ea950e515adaffbf5ae67ac497b0755e4070cda676168b996",
    "turboSha256": "4986207ed3f2a393671625acbf4f8fa06947696379423e2c046e2d8e9093d4c7",
    "packageArtifactsSha256": "c1a04916fd3d6904869a8dc9f0d4e8512fe4f959da7e79e039aab8a98f35589d",
    "baselinesSha256": "067aba9638577ece965e0ca7527e659ff6658dd97bb57c90ec9060fe2901ccd9",
    "integrationMatrixSha256": "982ccc82ba96f16aa35fa4a0f3ce319272bac9beb9d306419d356a9b42595821",
    "executionLockSha256": "c91e729ab343ffc652216dbcf9e4b8b3d650a6f1fecb8562dad7f419ba967aed"
  },
  "runtime": {
    "ciImage": "mcr.microsoft.com/playwright@sha256:c091b21d9fae78c76e85cd4356431e9b018402f172a214fc7d7a5e9a7e29d8ac",
    "ciImageDigest": "sha256:c091b21d9fae78c76e85cd4356431e9b018402f172a214fc7d7a5e9a7e29d8ac",
    "node": "24.19.0",
    "npm": "11.17.0",
    "architecture": "x64",
    "environment": {
      "CI": "1",
      "HUSKY": "0",
      "LC_ALL": "C",
      "TZ": "UTC",
      "UV_INDEX_URL": "https://pypi.org/simple",
      "UV_CACHE_DIR": "/tmp/uirouter-ci-uv-cache",
      "PLAYWRIGHT_BROWSERS_PATH": "/ms-playwright",
      "CYPRESS_CACHE_FOLDER": "/root/.cache/Cypress",
      "CHROME_BIN": "/ms-playwright/chromium-1234/chrome-linux64/chrome"
    },
    "npmInstallCommand": [
      "npm",
      "install",
      "--global",
      "npm@11.17.0",
      "--ignore-scripts",
      "--no-audit",
      "--no-fund"
    ],
    "npmRegistryBootstrapCommand": [
      "node",
      "tools/bootstrap-ci-registry-tarballs.mjs"
    ]
  },
  "actions": {
    "checkout": {
      "version": "v4.2.2",
      "sha": "11bd71901bbe5b1630ceea73d27597364c9af683"
    },
    "setupNode": {
      "version": "v4.4.0",
      "sha": "49933ea5288caeca8642d1e84afbd3f7d6820020"
    },
    "uploadArtifact": {
      "version": "v4.6.2",
      "sha": "ea165f8d65b6e75b540449e92b4886f43607fa02"
    }
  },
  "workflow": {
    "path": ".github/workflows/reproducibility.yml",
    "name": "Clean reproducibility",
    "runner": "ubuntu-24.04",
    "triggers": {
      "pullRequest": true,
      "pushBranches": ["main"]
    },
    "permissions": {
      "contents": "read"
    },
    "concurrency": {
      "group": "reproducibility-${{ github.workflow }}-${{ github.ref }}",
      "cancelInProgress": true
    },
    "timeoutMinutes": 180,
    "artifactRetentionDays": 7,
    "proofArtifactName": "clean-reproducibility-${{ github.sha }}"
  },
  "commands": [
    {
      "id": "install",
      "argv": ["npm", "ci", "--ignore-scripts", "--no-audit", "--no-fund"]
    },
    {
      "id": "prepare-browser",
      "argv": ["node", "tools/prepare-workspace-browser.mjs"]
    },
    {
      "id": "setup-browser",
      "argv": [
        "npm",
        "run",
        "setup:browser",
        "--",
        "--concurrency=1",
        "--cache=local:"
      ]
    },
    {
      "id": "build",
      "argv": ["npm", "run", "build", "--", "--cache=local:"]
    },
    {
      "id": "test",
      "argv": ["npm", "run", "test", "--", "--cache=local:", "--env-mode=loose"]
    },
    {
      "id": "prove-packages",
      "argv": ["npm", "run", "prove:package-artifacts"]
    },
    {
      "id": "stage-packages",
      "argv": [
        "node",
        "tools/stage-ci-package-artifacts.mjs",
        "--output",
        ".ci-artifacts/packages"
      ]
    },
    {
      "id": "verify-docs",
      "argv": ["npm", "run", "docs:verify"]
    },
    {
      "id": "cleanup-browser",
      "argv": ["node", "tools/prepare-workspace-browser.mjs", "--cleanup"]
    }
  ],
  "proof": {
    "runs": 2,
    "output": ".ci-results/reproducibility/proof.json",
    "sourceSnapshot": "git-archive",
    "cleanliness": "git-diff-and-lock"
  }
}
